{
  "schemaVersion": 1,
  "id": "f-0001",
  "rev": 2,
  "state": "triaged",
  "title": "Retry loop has no upper bound",
  "summary": "LoginClient.retry retries on every 5xx with no attempt limit, so an outage keeps the client in a tight loop.",
  "category": "reliability",
  "reviewerSeverity": "high",
  "location": { "path": "Sources/Auth/LoginClient.swift", "startLine": 88, "endLine": 104, "commit": "2222222222222222222222222222222222222222" },
  "sources": [
    { "sourceId": "gh:comment:9001", "excerpt": "1. The retry loop in LoginClient never stops on repeated 503s.", "ordinal": 0 }
  ],
  "research": {
    "verdict": "valid",
    "confidence": "high",
    "assessedSeverity": "medium",
    "analysis": "The loop at LoginClient.swift:88 retries while the status is 5xx. Backoff exists, but no attempt cap.",
    "evidence": [{ "path": "Sources/Auth/LoginClient.swift", "startLine": 92, "note": "while status >= 500" }],
    "options": [
      { "id": "A", "kind": "fix", "title": "Cap at 3 attempts", "description": "Add maxAttempts = 3 and surface the last error.", "pros": ["Smallest change"], "cons": ["Fixed number, not configurable"], "effort": "trivial" },
      { "id": "B", "kind": "fix", "title": "Cap from remote config", "description": "Read the cap from a config flag with default 3.", "pros": ["Tunable during an incident"], "cons": ["Adds a flag to manage"], "effort": "small" },
      { "id": "C", "kind": "dismiss", "title": "Not needed", "description": "The gateway already sheds load.", "pros": ["No change"], "cons": ["Client still loops if the gateway is unreachable"], "effort": "trivial" }
    ],
    "recommendedOptionId": "A",
    "researchedAt": "2026-10-03T17:50:00Z",
    "researchedAtCommit": "2222222222222222222222222222222222222222"
  },
  "decision": null,
  "notes": [],
  "investigation": null,
  "queue": null,
  "application": null,
  "reply": { "status": "none" },
  "staleReason": null,
  "createdAt": "2026-10-03T17:31:00Z",
  "updatedAt": "2026-10-03T17:50:00Z"
}
